title,price
Aspirador de Pó Vertical 2 em 1 Karcher VCL 1 com Filtro Hepa 1000W,"199,89"
Aspirador de Pó Vertical 2 em 1 Kärcher VCL 2 com filtro 220V,"199,90"
"Karcher Aspirador de Pó Vertical 2 em 1 VCL 3 BATERIA, Cor: Branco","399,00"
Aspirador de pó PowerDust 12000 Midea Preto 127V,"479,00"
"Electrolux, STK15 PowerSpeed Ultra - Aspirador Vertical com Fio, 127V, Urban Grey","227,00"
"Electrolux Aspirador vertical com fio STK12 220V, Preto","172,80"
"Aspirador de Pó Turbo Cycle, Mondial, Vermelho/Preto, 1100W, 110V - AP-36","209,90"
"Electrolux Aspirador Vertical 1300W STK14 127V, Denim Blue","208,05"
"WAP Silent Speed Max 3 e 1 - Aspirador de Pó Vertical, 1350W, Filtro HEPA e Tecnologia Cyclone, 127V","218,17"
Aspirador Pó Philco Vertical Power Clean 2000W PAS4000V 220V,"219,90"
Aspirador de Pó vertical bateria Ergorapido 2 em 1 Electrolux 21min 2 velocidades capacidade 460Ml ERG21 Bivolt Branco,"529,00"
Aspirador de Pó Vertical WAP POWER SPEED 2000W 3L Potente 2 em 1 com Mangueira Extensora Flexível 127V,"723,30"
Aspirador de Pó Vertical 2 em 1 Kärcher VCL 2 com filtro 127V,"266,70"
"WAP Aspirador de Pó High Speed Plus 3 em 1 Vertical e de Mão 1350W, com Bico Canto e Tecnologia Cyclone 127V","203,46"
"Aspirador de Pó Vertical Turbo Cycle, Mondial, Preto/Laranja, 1100W, 110V - AP-35","174,90"
Aspirador de Pó Vertical 2 em 1 1250W Britânia BAS1290V 127V,"151,92"
"Aspirador pó vertical com fio portátil de mão 2 em 1 1100W cabo 5m capacidade 1,2L filtro HEPA Electrolux STK13 A 127v","179,00"
Aspirador de Pó Philco Vertical 2 em 1 1450w Preto Pas1600p - 127,"209,99"
WAP Aspirador de Pó Vertical com Mangueira Flexível 2000W WAP LIFE SPEED 220V,"549,99"
"Aspirador pó vertical com fio portátil de mão 2 em 1 1450W cabo 5m capacidade 1,6L filtro HEPA Electrolux STK14 B 127v","229,00"
WAP Aspirador de Pó e Água Profissional 1600W 50 Litros 180 mbar Barril Aço Inox Soprador WAP GTW INOX 50 220V,"1.169,90"
WAP Aspirador de Pó e Água 20L 1600W Vácuo de 160mbar com Regulagem de Sucção Bocal de Sopro e Porta Acessórios WAP GTW 20 220V,"460,90"
Saco aspirador de Pó Consul Facilite Ref. 2179 - Porto- Pel,"20,60"
03 Insea 2 - Original,"199,00"
"Electrolux Aspirador vertical com fio STK13 127V, Vermelho","196,90"
Aspirador de Pó vertical bateria Ergorapido 2 em 1 Electrolux 38 min base recarregamento luz frontal LED capacidade 420Ml ERG25N Bivolt Azul,"839,00"
Aspirador de Pó Vertical 2 em 1 Karcher VCL 1 com Filtro Hepa 1000W,"167,31"
Aspirador de Pó Vertical 2 em 1 1300W Philco PAS1450C 220V,"209,00"
"Aspirador de Pó Vertical Turbo Premium, Mondial, Vermelho, 1200W, 110V - AP-30","206,06"
"Aspirador Vertical, ERG22, 2 em 1, Verde, Bivolt, Electrolux","899,99"
"Aspirador de Pó, Ciclone Force Pas06, 1250w, Preto, 220v, Philco","246,90"
Gaabor Aspirador de Pó Vertical 2 em Portatil 220v,"139,90"
Aspirador de Pó Vertical Perfect Clean II 2 em 1 Elgin Preto Compacto e Desmontável 220V,"156,99"
Aspirador de Pó Vertical Britânia 2 em 1 BAS1295P 1250W 220V,"177,11"
Aspirador de Pó Vertical Britânia 2 em 1 BAS1295P 1250W 127V,"182,90"
"Karcher Aspirador de Pó Vertical 2 em 1 VCL 3 BATERIA, Cor: Branco","399,00"
Aspirador de Pó Vertical Britânia Filtro Ciclone 1400W BAS1500V 127V,"199,74"
"WAP WAPORE UP - Extratora e Higienizadora com Vapor e MOP, Aspirador de Pó Vertical, 1600W, Passa Pano, Limpa e dá Brilho, 127V, Branco, Titanium e Azul","949,98"
Aspirador de Pó Philco PAS1450C 2 em 1 1300W 127V,"170,91"
BLACK+DECKER Aspirador de Pó Ciclônico 2 em 1 Power Up 1250W 127V AVT12,"365,00"
Aspirador de pó PowerDust 12000 Midea Preto 220V,"495,64"
Aspirador de Pó e Água WAP GTW 10 1400W 140mbar Compacto e Robusto com Soprador 127V,"289,00"
Aspirador de Pó Vertical 2 em 1 Karcher VCL 1 com Filtro Hepa 1000W,"199,89"
"Aspirador pó vertical com fio portátil de mão 2 em 1 1450W cabo 5m capacidade 1,6L filtro HEPA Electrolux STK14 B 220v","229,00"
"Aspirador vertical sem fio ERG24N, Bivolt, Electrolux","879,00"
"Aspirador de Pó Oster, 2 em 1, Vertical, 110V, OASP601","226,96"
"Aspirador de Pó Vertical Oster Sem Fio White Duo Clean 2 em 1, Bateria, Branco, OASP645","670,00"
Aspirador Vertical de Pó Liectroux i7 Pro Sem Fio Aspira Passa Pano e Autolimpante Bateria Duradoura,"2.769,00"
Aspirador Vertical De Pó Portátil C/Função Mop Multiuso 120W 7500pa 600ml 3 em 1 Filtro Lavável Recarregável USB Sem Fio Bivolt Sujeira Sofá Carro Casa Limpeza Extra Forte Funcional Modelo: FH-268,"147,80"
Aspirador de Pó Vertical e Portátil Sem Fio WAP ULTRA MOB 2 em 1 com Mangueira a Bateria Carregador Bivolt,"575,36"
WAP Aspirador de Pó Sem Fio MAGIC Vertical e Portátil Multifunções 3 Ní­veis de Velocidade com Alto Poder de Sucção 450W 220 mbar Luz UVC Antiácaro Bateria Bivolt,"1.944,00"
"Aspirador de pó PAS11P, Philco, Bivolt","395,90"
Aspirador de Pó Vertical Britânia Filtro Ciclone 1400W BAS1500V 220V,"222,27"
"WAP ROBOT W90 - Aspirador de Pó Robô, Automático 3 em 1 Varre, Aspira, Passa Pano, MOP para Limpeza, 30W, Bateria Recarregável, Bivolt, Preto","344,90"
Aspirador de Pó Vertical Sem Fio Oster Duo Clean 2 em 1 - Bateria OASP651,"971,19"
ASPIRADOR DE PÓ VERTICAL ERG28 18V ERGORAPIDO ELECTROLUX SEM FIO 2 EM 1 LUZ LED,"1.899,99"
SACO PARA ASPIRADOR DE PO DESCARTAVEL REF.11265 3 UND.,"17,90"
"Robô Aspirador de Pó Karcher RCV 5 com Mapeamento Inteligente, Aspira e Passa Pano.Controle via Aplicativo.Autonomia de 120 min. Navegação a Laser LiDAR, Laser Duplo e Inteligência Artificial - Bivolt","4.450,90"
Robô Aspirador de Pó Karcher RCV 1 controle remoto 3 modos de limpeza sensor anti-queda e de colisão – Bivolt,"928,90"
"Robô Aspirador de Pó Karcher RCV 3 com Mapeamento Inteligente, Aspira e Passa Pano. Controle via Aplicativo. Autonomia de 120 min. Navegação a Laser LiDAR e Sensor 360° - Bivolt","2.899,90"
