title,timestamp
Fritadeira Sem Óleo Air Fryer EOS Chef Gourmet 3 Litros Preto EAF30 110V,2024-07-16 21:35:05
"Fritadeira Elétrica Start Fry Elgin 3,5 Litros Preta 110v - Air Fryer",2024-07-16 21:35:05
Fritadeira Sem Óleo Air fryer Eos Chef Gourmet 4 Litros Preto Eaf40p 220v,2024-07-16 21:35:05
Fritadeira Sem Óleo Air fryer Eos Chef Gourmet 4 Litros Preto com Cinza Eaf40s 110v,2024-07-16 21:35:05
Fritadeira Philco Air Fryer Oven 12L PFR2200P - 220V,2024-07-16 21:35:05
"Fritadeira Air Fryer Forno Oven 12 Litros, Mondial, Preto/Inox, 2000W, 110V - AFO-12L-BI",2024-07-16 21:35:05
"Fritadeira Sem Óleo Oster 127V - OFRT520, PRETO",2024-07-16 21:35:05
"Fritadeira Sem Óleo Air Fryer 4L, Mondial, Preto/Inox, 1500W, 110V - AFN-40-BI",2024-07-16 21:35:05
"Fritadeira Air Fryer Gourmet Philco 4,4 Litros 1500w Preto Pfr15pg - 127v",2024-07-16 21:35:05
"Fritadeira Elétrica Start Fry Elgin 3,5 Litros Preta 110v - Air Fryer",2024-07-16 21:35:05
"Fritadeira Sem Óleo Air Fryer 5L, Mondial, Preto/Inox, 1900W, 110V - AFN-50-BI",2024-07-16 21:35:05
"Oster OFRT780 - Fritadeira forno 3 em 1, 127V, 1800 W, Preto",2024-07-16 21:35:05
"WAP Fritadeira Elétrica Air Fryer 5,2 Litros Temperatura Ajustável com Duplo Revestimento Antiaderente, Cesto e Grelha Removíveis 1500W AIRFRY Grand Family 127V",2024-07-16 21:35:05
"Philips Walita Preta Fritadeira Airfryer Essential XL Digital, 6.2L de capacidade, Garantia internacional de dois anos, 110V, 2000W (RI9270/90), Preto",2024-07-16 21:35:05
Fritadeira Air Fryer 5L Britânia BFR40PI Preta 127V,2024-07-16 21:35:05
