title,timestamp
"Aspirador de Pó Vertical Turbo Cycle, Mondial, Preto/Laranja, 1100W, 220V - AP-35",2024-07-15 17:04:07
WAP Aspirador de Pó e Água Profissional 1600W 50 Litros 180 mbar Barril Aço Inox Soprador WAP GTW INOX 50 220V,2024-07-15 17:04:07
Aspirador de Pó Robô WAP ROBOT W100 Bivolt Automático 3 em 1 Varre Aspira e Passa Pano MOP para Limpeza,2024-07-15 17:04:07
"Robô Aspirador de Pó LILIN XR500, reconhecimento de obstáculos,110/220V Bivolt, 5000KPa, mapa de memória multicamada, limpeza personalizada, ajuste multilíngue, ultrafino e silencioso",2024-07-15 17:04:07
"Electrolux, STK15 PowerSpeed Ultra - Aspirador Vertical com Fio, 127V, Urban Grey",2024-07-15 17:04:07
"Electrolux Aspirador vertical com fio STK12 220V, Preto",2024-07-15 17:04:07
"Aspirador de Pó Turbo Cycle, Mondial, Vermelho/Preto, 1100W, 110V - AP-36",2024-07-15 17:04:07
"Electrolux Aspirador Vertical 1300W STK14 127V, Denim Blue",2024-07-15 17:04:07
"WAP Silent Speed Max 3 e 1 - Aspirador de Pó Vertical, 1350W, Filtro HEPA e Tecnologia Cyclone, 127V",2024-07-15 17:04:07
Aspirador Pó Philco Vertical Power Clean 2000W PAS4000V 220V,2024-07-15 17:04:07
Aspirador de Pó Vertical WAP POWER SPEED 2000W 3L Potente 2 em 1 com Mangueira Extensora Flexível 127V,2024-07-15 17:04:07
Aspirador de Pó vertical bateria Ergorapido 2 em 1 Electrolux 21min 2 velocidades capacidade 460Ml ERG21 Bivolt Branco,2024-07-15 17:04:07
Aspirador de Pó Vertical 2 em 1 Kärcher VCL 2 com filtro 127V,2024-07-15 17:04:07
"WAP Aspirador de Pó High Speed Plus 3 em 1 Vertical e de Mão 1350W, com Bico Canto e Tecnologia Cyclone 127V",2024-07-15 17:04:07
Aspirador de Pó Vertical 2 em 1 1250W Britânia BAS1290V 127V,2024-07-15 17:04:07
