title,timestamp
Extratora e Higienizadora Vertical WAP COMFORT CLEANER PRO 2000W 2 em 1 Escova Elétrica Tapetes e Carpetes 220V,2024-07-16 12:41:10
Extratora de Sujeira WAP HOME CLEANER 20L 1600W Máquina para Limpeza de Pisos Tapetes Carpetes Sofás Estofados 127V,2024-07-16 12:41:10
Extratora e Higienizadora Vertical WAP POWER CLEANER PRO 2000W 2 em 1 Escova Elétrica Tapetes e Carpetes 220V,2024-07-16 12:41:10
"Extratora Portátil 400W Limpeza Estofados Tapetes Sofás Vonder ELV400 (220, Volts)",2024-07-16 12:41:10
"Extratora de Sujeira WAP Aqua Cleaner (110, Volts)",2024-07-16 12:41:10
"WAP WAPORE UP - Extratora e Higienizadora com Vapor e MOP, Aspirador de Pó Vertical, 1600W, Passa Pano, Limpa e dá Brilho, 127V, Branco, Titanium e Azul",2024-07-16 12:41:10
Limpadora de Estofados Puzzi 4/15Classic 220V,2024-07-16 12:41:10
LAVA PRO - EXTRATORA E ASPIRADOR PROFISSIONAL - SÓLIDOS E LÍQUIDOS,2024-07-16 12:41:10
Vaporizador e Higienizador 1500W Vapor Clean com 14 acessórios Intech Machine (220V),2024-07-16 12:41:10
"Extratora Profissional 25 Litros 1600W WAP CARPET CLEANER 220V, Amarelo com Preto",2024-07-16 12:41:10
"WAP Extratora Barril Carpet Cleaner ECO com Bocal de Sopro, Limpeza Pesada 1450W 220V",2024-07-16 12:41:10
"Extrator de Sucos Turbo Premium, Mondial, Preto/Inox, 250W, Bivolt - E-10",2024-07-16 12:41:10
Extratora de Sujeira Britânia BEX2000V 3 em 1 1200W 127V,2024-07-16 12:41:10
Extrator De Leite El�trico Fisher Price BB320,2024-07-16 12:41:10
Extratora de Sujeira WAP Multi Cleaner | 220V,2024-07-16 12:41:10
