title,timestamp
Bomba de Tirar Leite Elétrica com Extrator de Mão Livre e Monitor de Maternidade (Rosa),2024-07-16 20:56:16
Bomba de Tirar Leite Elétrica com Extrator de Mão Livre e Monitor de Maternidade (Branco),2024-07-16 20:56:16
"WAP Spot Cleaner 3 em 1 - Extratora e Higienizadora Portátil, Borrifa, Esfrega e Extrai, 1600W, 127V",2024-07-16 20:56:16
Extratora e Higienizadora Vertical WAP COMFORT CLEANER PRO 2000W 2 em 1 Escova Elétrica Tapetes e Carpetes 127V,2024-07-16 20:56:16
Extratora de Sujeira WAP HOME CLEANER 20L 1600W Máquina para Limpeza de Pisos Tapetes Carpetes Sofás Estofados 127V,2024-07-16 20:56:16
Extratora e Higienizadora Vertical WAP POWER CLEANER PRO 2000W 2 em 1 Escova Elétrica Tapetes e Carpetes 220V,2024-07-16 20:56:16
"Extratora Portátil 400W Limpeza Estofados Tapetes Sofás Vonder ELV400 (220, Volts)",2024-07-16 20:56:16
"WAP Extratora Potente 1600W 190 mbar CARPET CLEANER PRO 30 3 Níveis de Filtragem 127V, Amarelo, Preto e Inox",2024-07-16 20:56:16
Extrator De Leite El�trico Fisher Price BB320,2024-07-16 20:56:16
"Extrator de Sucos Turbo Premium, Mondial, Preto/Inox, 250W, Bivolt - E-10",2024-07-16 20:56:16
"WAP Extratora Portátil Spot Cleaner W3 1450W de Potência e Vácuo de 110Mbar 3 em 1 Borrifa, Esfrega e Extrai 127V",2024-07-16 20:56:16
"Extratora de Sujeira WAP Aqua Cleaner (110, Volts)",2024-07-16 20:56:16
"WAP WAPORE UP - Extratora e Higienizadora com Vapor e MOP, Aspirador de Pó Vertical, 1600W, Passa Pano, Limpa e dá Brilho, 127V, Branco, Titanium e Azul",2024-07-16 20:56:16
Limpadora de Estofados Puzzi 4/15Classic 220V,2024-07-16 20:56:16
Vaporizador e Higienizador 1500W Vapor Clean com 14 acessórios Intech Machine (220V),2024-07-16 20:56:16
