title,timestamp
"Kärcher K5 - Lavadora de Alta Pressão, 127v, Motor a Indução",2024-07-17 10:03:05
Lavadora de Alta pressão Kärcher Profissional HD 4/10 X Classic - 2100 psi,2024-07-17 10:03:05
Lavadora de Alta Pressão K3.100 Black Lavadora de Alta Pressão K 3.100 Black - 127v,2024-07-17 10:03:05
Lavadora de Alta pressão Kärcher K2 Plus CAR 127V – 1740 psi,2024-07-17 10:03:05
Lavadora de Alta Pressão WAP ATACAMA SMART 2200 1400W 1500 PSI/Libras 330L/h Jato Leque e Concentrado 220V,2024-07-17 10:03:05
Lavadora de Alta Pressão WAP OUSADA PLUS 2200 1500W 1750 PSI/Libras 342L/h Jato Leque e Concentrado Máquina Voltagem 127 V,2024-07-17 10:03:05
Lavadora de Alta pressão Kärcher K2 Plus CAR 127V – 1740 psi,2024-07-17 10:03:05
Lavadora de alta pressão Electrolux 1400W 1800PSI gratis engate rápido lava jato potente econômico preto e amarelo EWS30 127V,2024-07-17 10:03:05
Lavadora de Alta Pressão WAP ÁGIL 1800 1400W 1300 PSI/Libras 300L/h Portátil Compacta Jato Leque e Concentrado 220V,2024-07-17 10:03:05
"WAP COMBATE TURBO 2600 - Lavadora de Alta Pressão Indução, 1700W, 2100 PSI/Libras, 360L/h Profissional, Semi Intensivo, 220V",2024-07-17 10:03:05
"WAP Lavadora de Alta Pressão WL 4000 Limpeza Profissional 2000W, Bico Regulável, com Economia de Água 220V",2024-07-17 10:03:05
Lavadora de Alta Pressão Profissional WAP 5100 TURBO 2500W 2300 PSI/Libras 550L/h Lava Rápido Motor Indução 220V,2024-07-17 10:03:05
"Kärcher K3 Force CAR - Lavadora de Alta pressão, 127V, 1815 psi",2024-07-17 10:03:05
Arruela elétrica de alta pressão - Acessórios para lavadora de pressão - Fluxo de 1000 W 160 l/h 36 v,2024-07-17 10:03:05
"Vonder, Lavadora de Alta Pressão LAV 1300, 1.300 lbf/pol², 220 V~.",2024-07-17 10:03:05
