title,timestamp
"WAP COMBATE TURBO 2600 - Lavadora de Alta Pressão, Indução 1700W, 2100 PSI/Libras, 360L/h, Profissional, Semi Intensivo, 127V",2024-07-15 17:04:07
Aspirador de Pó e Água WAP GTW 10 1400W 140mbar Compacto e Robusto com Soprador 127V,2024-07-15 17:04:07
Lavadora de Alta Pressão 2.175 Libras 500 Litros/Hora Karcher HD585 Profi New (220V),2024-07-15 17:04:07
Aspirador de Pó Robô WAP ROBOT W100 Bivolt Automático 3 em 1 Varre Aspira e Passa Pano MOP para Limpeza,2024-07-15 17:04:07
"WAP Spot Cleaner 3 em 1 - Extratora e Higienizadora Portátil, Borrifa, Esfrega e Extrai, 1600W, 127V",2024-07-15 17:04:07
Lavadora de Alta Pressão WAP OUSADA PLUS 2200 1500W 1750 PSI/Libras 342L/h Jato Leque e Concentrado Máquina Voltagem 127 V,2024-07-15 17:04:07
"WAP ROBOT W90 - Aspirador de Pó Robô, Automático 3 em 1 Varre, Aspira, Passa Pano, MOP para Limpeza, 30W, Bateria Recarregável, Bivolt, Preto",2024-07-15 17:04:07
WAP Detergente Limpador Para Extratoras Limpa E Extrai 5L Com Fragrância E Sem Espuma Branco E Azul,2024-07-15 17:04:07
WAP Parafusadeira E Furadeira A Bateria Li-Ion 12V Bpf 12K3 Carregador Bivolt Sem Fio Com Maleta E Kit De 13 Acessórios,2024-07-15 17:04:07
Extratora e Higienizadora Vertical WAP COMFORT CLEANER PRO 2000W 2 em 1 Escova Elétrica Tapetes e Carpetes 127V,2024-07-15 17:04:07
Lavadora de Alta Pressão WAP ATACAMA SMART 2200 1400W 1500 PSI/Libras 330L/h Jato Leque e Concentrado 220V,2024-07-15 17:04:07
Aspirador de Pó Vertical WAP POWER SPEED 2000W 3L Potente 2 em 1 com Mangueira Extensora Flexível 127V,2024-07-15 17:04:07
"WAP COMBATE TURBO 2600 - Lavadora de Alta Pressão, Indução 1700W, 2100 PSI/Libras, 360L/h, Profissional, Semi Intensivo, 127V",2024-07-15 17:04:07
"WAP Silent Speed Max 3 e 1 - Aspirador de Pó Vertical, 1350W, Filtro HEPA e Tecnologia Cyclone, 127V",2024-07-15 17:04:07
Aspirador de Pó e Água WAP GTW 10 1400W 140mbar Compacto e Robusto com Soprador 127V,2024-07-15 17:04:07
